{
  "_meta": {
    "authored": "2026-06-23",
    "sources": [
      "tests/fixtures/planilhas/draft_survey/draft_survey.real.v1.xlsx",
      "tests/fixtures/reports/draft_survey/MV-PERSEUS-I.model.docx"
    ],
    "field_map": "tests/fixtures/reports/draft_survey/field-map.md",
    "targets_schema_contract": 2,
    "notes": [
      "Contrato v2: campos com `sheet` por campo, fingerprint com `sheet`, `variant_source` (Capa!L4) e `tables` (range-based). O validateSpec/extractor atuais (contrato v1, aba única) precisam ser estendidos antes de validar/extrair este spec — ver implementation/003 T-013..T-016.",
      "Ranges de `tables` marcados como provisorios: confirmar limites contra o render nativo (003/T-016).",
      "DATAS (2026-06-23): os mirrors Capa!L7/L8/L9 são fórmulas dynamic-array LET que o ExcelJS NÃO avalia (result=Invalid Date → NaN). Lemos as datas direto das células-fonte avaliáveis Inicial!C7, Intermediario!C5, final!C5 (type=date → ISO; o builder formata em inglês 'Month Dth, YYYY'). Horas (M/N) seguem na Capa, que o ExcelJS avalia.",
      "int_fig_diff_pct e fin_fig_diff_pct guardam o percentual já em pontos percentuais (0.0398 representa 0.0398%)."
    ]
  },

  "report_type": "draft_survey",
  "version": 1,
  "contract": 2,
  "variants": ["loading", "discharge"],

  "source": {
    "fingerprint": { "sheet": "Capa", "cell": "B2", "expect": "DRAFT SURVEY" },
    "variant_source": {
      "sheet": "Capa",
      "cell": "L4",
      "map": { "Loading": "loading", "Discharge": "discharge" }
    },
    "ignore_sheets": ["LOD-LOP"],

    "common": {
      "fields": {
        "ref": { "sheet": "Capa", "cell": "C4", "type": "string", "label": "Ref", "section": "Serviço" },
        "port": { "sheet": "Capa", "cell": "C5", "type": "string", "required": true, "label": "Porto de atendimento", "section": "Serviço" },
        "terminal": { "sheet": "Capa", "cell": "C6", "type": "string", "label": "Terminal", "section": "Serviço" },
        "shed": { "sheet": "Capa", "cell": "C7", "type": "string", "label": "Armazém (shed)", "section": "Serviço" },
        "cargo": { "sheet": "Capa", "cell": "C8", "type": "string", "required": true, "label": "Carga", "section": "Serviço" },
        "discharging_port": { "sheet": "Capa", "cell": "C9", "type": "string", "label": "Porto de destino/descarga", "section": "Serviço" },
        "voyage": { "sheet": "Capa", "cell": "C10", "type": "string", "label": "Viagem", "section": "Serviço" },
        "agency": { "sheet": "Capa", "cell": "C11", "type": "string", "label": "Agência", "section": "Serviço" },
        "official_figures": { "sheet": "Capa", "cell": "L5", "type": "string", "label": "Official figures", "section": "Serviço" },

        "vessel_name": { "sheet": "Capa", "cell": "C13", "type": "string", "required": true, "label": "Nome do navio", "section": "Particulars do navio" },
        "flag": { "sheet": "Capa", "cell": "C14", "type": "string", "label": "Bandeira", "section": "Particulars do navio" },
        "register_port": { "sheet": "Capa", "cell": "C15", "type": "string", "label": "Porto de registro", "section": "Particulars do navio" },
        "call_sign": { "sheet": "Capa", "cell": "C16", "type": "string", "label": "Indicativo de chamada", "section": "Particulars do navio" },
        "imo": { "sheet": "Capa", "cell": "C17", "type": "string", "label": "IMO", "section": "Particulars do navio" },
        "vessel_type": { "sheet": "Capa", "cell": "C18", "type": "string", "label": "Tipo", "section": "Particulars do navio" },
        "delivered": { "sheet": "Capa", "cell": "C19", "type": "number", "decimals": 0, "label": "Ano de entrega", "section": "Particulars do navio" },
        "loa": { "sheet": "Capa", "cell": "C20", "type": "number", "decimals": 2, "unit": "m", "label": "LOA", "section": "Particulars do navio" },
        "lbp": { "sheet": "Capa", "cell": "C21", "type": "number", "decimals": 2, "unit": "m", "label": "LBP", "section": "Particulars do navio" },
        "depth_moulded": { "sheet": "Capa", "cell": "C22", "type": "number", "decimals": 2, "unit": "m", "label": "Pontal moldado", "section": "Particulars do navio" },
        "breadth_moulded": { "sheet": "Capa", "cell": "C23", "type": "number", "decimals": 2, "unit": "m", "label": "Boca moldada", "section": "Particulars do navio" },
        "net_tonnage": { "sheet": "Capa", "cell": "C24", "type": "number", "decimals": 1, "unit": "mt", "label": "Net tonnage", "section": "Particulars do navio" },
        "gross_tonnage": { "sheet": "Capa", "cell": "C25", "type": "number", "decimals": 1, "unit": "mt", "label": "Gross tonnage", "section": "Particulars do navio" },
        "summer_dwt": { "sheet": "Capa", "cell": "C26", "type": "number", "decimals": 1, "unit": "mt", "label": "Summer DWT", "section": "Particulars do navio" },

        "captain": { "sheet": "Capa", "cell": "C28", "type": "string", "label": "Comandante", "section": "Comando" },
        "chief_officer": { "sheet": "Capa", "cell": "C29", "type": "string", "label": "Imediato", "section": "Comando" },

        "berthing_side": { "sheet": "Capa", "cell": "C31", "type": "enum", "options": ["Port Side", "Starboard"], "label": "Lado de atracação", "section": "Operação" },
        "client": { "sheet": "Capa", "cell": "C33", "type": "string", "label": "Cliente", "section": "Partes" },
        "operator": { "sheet": "Capa", "cell": "C34", "type": "string", "label": "Operador / contato", "section": "Partes" },

        "initial_date": { "sheet": "Inicial", "cell": "C7", "type": "date", "format": "Month Do, YYYY", "label": "Data — Inicial", "section": "Datas" },
        "initial_start": { "sheet": "Capa", "cell": "M7", "type": "time", "label": "Início — Inicial", "section": "Datas" },
        "initial_end": { "sheet": "Capa", "cell": "N7", "type": "time", "label": "Fim — Inicial", "section": "Datas" },
        "intermediate_date": { "sheet": "Intermediario", "cell": "C5", "type": "date", "format": "Month Do, YYYY", "label": "Data — Intermediário", "section": "Datas" },
        "intermediate_start": { "sheet": "Capa", "cell": "M8", "type": "time", "label": "Início — Intermediário", "section": "Datas" },
        "intermediate_end": { "sheet": "Capa", "cell": "N8", "type": "time", "label": "Fim — Intermediário", "section": "Datas" },
        "final_date": { "sheet": "final", "cell": "C5", "type": "date", "format": "Month Do, YYYY", "required": true, "label": "Data — Final", "section": "Datas" },
        "final_start": { "sheet": "Capa", "cell": "M9", "type": "time", "label": "Início — Final", "section": "Datas" },
        "final_end": { "sheet": "Capa", "cell": "N9", "type": "time", "label": "Fim — Final", "section": "Datas" },

        "init_fwd_mean": { "sheet": "Inicial", "cell": "D10", "type": "number", "decimals": 3, "unit": "m", "label": "AV (Fwd) médio", "section": "Calados — Inicial" },
        "init_fwd_corr": { "sheet": "Inicial", "cell": "H10", "type": "number", "decimals": 4, "unit": "m", "label": "AV (Fwd) corrigido", "section": "Calados — Inicial" },
        "init_mid_mean": { "sheet": "Inicial", "cell": "D11", "type": "number", "decimals": 3, "unit": "m", "label": "MN (Ms) médio", "section": "Calados — Inicial" },
        "init_mid_corr": { "sheet": "Inicial", "cell": "H11", "type": "number", "decimals": 4, "unit": "m", "label": "MN (Ms) corrigido", "section": "Calados — Inicial" },
        "init_aft_mean": { "sheet": "Inicial", "cell": "D12", "type": "number", "decimals": 3, "unit": "m", "label": "AR (Aft) médio", "section": "Calados — Inicial" },
        "init_aft_corr": { "sheet": "Inicial", "cell": "H12", "type": "number", "decimals": 4, "unit": "m", "label": "AR (Aft) corrigido", "section": "Calados — Inicial" },
        "init_trim_obs": { "sheet": "Inicial", "cell": "D15", "type": "number", "decimals": 4, "unit": "m", "label": "Trim observado", "section": "Calados — Inicial" },
        "init_trim_corr": { "sheet": "Inicial", "cell": "G15", "type": "number", "decimals": 4, "unit": "m", "label": "Trim corrigido", "section": "Calados — Inicial" },
        "init_heel": { "sheet": "Inicial", "cell": "Z24", "type": "number", "decimals": 2, "unit": "°", "label": "Heel", "section": "Calados — Inicial" },
        "init_heel_side": { "sheet": "Inicial", "cell": "Y25", "type": "string", "label": "Heel — lado", "section": "Calados — Inicial" },
        "init_deflection": { "sheet": "Inicial", "cell": "G17", "type": "number", "decimals": 1, "unit": "cm", "label": "Deflection", "section": "Calados — Inicial" },
        "init_deflection_type": { "sheet": "Inicial", "cell": "G18", "type": "string", "label": "Deflection — tipo", "section": "Calados — Inicial" },

        "int_fwd_mean": { "sheet": "Intermediario", "cell": "D9", "type": "number", "decimals": 3, "unit": "m", "label": "AV (Fwd) médio", "section": "Calados — Intermediário" },
        "int_fwd_corr": { "sheet": "Intermediario", "cell": "H9", "type": "number", "decimals": 4, "unit": "m", "label": "AV (Fwd) corrigido", "section": "Calados — Intermediário" },
        "int_mid_mean": { "sheet": "Intermediario", "cell": "D10", "type": "number", "decimals": 3, "unit": "m", "label": "MN (Ms) médio", "section": "Calados — Intermediário" },
        "int_mid_corr": { "sheet": "Intermediario", "cell": "H10", "type": "number", "decimals": 4, "unit": "m", "label": "MN (Ms) corrigido", "section": "Calados — Intermediário" },
        "int_aft_mean": { "sheet": "Intermediario", "cell": "D11", "type": "number", "decimals": 3, "unit": "m", "label": "AR (Aft) médio", "section": "Calados — Intermediário" },
        "int_aft_corr": { "sheet": "Intermediario", "cell": "H11", "type": "number", "decimals": 4, "unit": "m", "label": "AR (Aft) corrigido", "section": "Calados — Intermediário" },
        "int_trim_obs": { "sheet": "Intermediario", "cell": "D14", "type": "number", "decimals": 4, "unit": "m", "label": "Trim aparente", "section": "Calados — Intermediário" },